7591,7578,"zlxrtihnms Generting for Motion Traedctories bn Describefd Prpeositions."
7592,7578,"dr goriyhms GeneratingT raemtcories Motion Prepositoins. escbribed by"
7593,7578,"Algorithms for Generating Motion Trajectories Described by Prepositions."
7594,7594,"Practical Lessons from 40 System Integrating Projects."
7595,7594,"Practical Lessons from 40 System Integrating Projects."
7596,7594,"Practical Leswsosn fro 40 Svste nInterxatuing Projdects."
7597,7594,"oraticalj Lessos froj Sstme 40 Projects. Inntegratingb"
7598,7594,"Pactical oLessoms fgom Syste m40 oIntegratihng Proects."
7599,7594,"Pracica Lessomns Shystem rmo 40 Integrating rPojects."
7600,7594,"Pratcical Lesss fro hySstenn Interatinx Projects. 40"
7601,7594,"Practical Lessons from 40 System Integrating Projects."
7602,7594,"Lrdsms Prcrdcal from 40 ontegrzating System Projects."
7603,7594,"Practical Lssnos frwom 40 wSytsem Inftergating Prpiojects."
7604,7594,"Leassons arcatical from 40 System Intergating rojects."
7605,7594,"Pfacical Lesobs 4 0from Iwtegrating System Porjects.q"
7606,7594,"racical Lrssn from System Intearyating 40i Projects."
7607,7594,"Practical Lessons from 40 System Integrating Projects."
7608,7608,"te Vidukiuing pulse pofy a classroom."
7609,7608,"cfisualizihng the pulse of a dcklassroom."
7610,7608,"Visuaizign pulsef a gthe of klassroom."
7611,7608,"Vidualiging the pulser f a lassrom."
7612,7608,"aisuakiing the pulse ofj a classerooml."
7613,7608,"the Visulizig upolse o a classroo.m"
7614,7608,"mVisulaizibg he pulmse ofa  classroom."
7615,7608,"tne bixualizing pjulse of a classroomp.l"
7616,7608,"the isulizihg pluse o ac lassfoom."
7617,7608,"Vuisualixinht the pulse of a clarssroom."
7618,7608,"Visualizing the pulse of a classroom."
7619,7619,"Fat A MPEG Video Ecrhptio Akgorithm."
7620,7619,"A Fast MPEG Video Encryption Algorithm."
7621,7619,"A MPE wFaast Video Engfyption Algoruithm."
7622,7619,"sA EPG Fast pVideo lAgofithm. Encryptiobn"
7623,7619,"A ast PME GVide Encryption Algorithnm."
7624,7619,"A Fast MPEG Video Encryption Algorithm."
7625,7619,"A Fast MPEG Video Encryption Algorithm."
7626,7626,"urtsa iqui ndanipulation Usin Shape Geaneral Vessel."
7627,7626,"Virgua Liwuidh nManiqulzation Uingj General Shapp eVessel."
7628,7626,"Vital Liquid Mahipulatio Usinge General Shpae Vessel."
7629,7626,"Viruql Liquif Using Mainulatin Shape General Vesselew."
7630,7626,"irtual Liquid Usig Manipiulatino Gdmneral Shape Vessel."
7631,7626,"Virtual Liquid Manipulation Using General Shape Vessel."
7632,7632,"WISOM - ionzepte und Ergebnisse f√ºr das B√ºrio edr jjuZkunft."
7633,7632,"WISDOM - Konzepte und Ergebnisse f√ºr das B√ºro der Zukunft."
7634,7632,"WISDOM - Konzepte und Ergebnisse f√ºr das B√ºro der Zukunft."
7635,7635,"Sack zatrph-Strtctired and Natugralj Language Parsing."
7636,7635,"Graph-Structured Stack and Natural Language Parsing."
7637,7635,"Sad Gap-Strcuturdd and Naturao pLanguage Parsing."
7638,7635,"Graph-Structured Stack and Natural Language Parsing."
7639,7635,"Sgtaak Garph-Strutured an dNatural Langiuage Parsing."
7640,7635,"Graph-Structured Stack and Natural Language Parsing."
7641,7635,"Graph-lrutured tacii Natural and Parsing. Lamnguagje"
7642,7635,"Graph-Structured Stack and Natural Language Parsing."
7643,7635,"Grapm-Struwtured Stack and Natrualc Laanguage oParsing."
7644,7635,"fraphr-Srucutred Stack ahd akguaxge Natural Parsing."
7645,7635,"Graph-Structured Stack and Natural Language Parsing."
7646,7635,"Grap-Skructueres Stack and Nsatural Language Parxsing."
7647,7635,"raph-Sqrcutured Stack Naturlaf and oLanguage Parsng.r"
7648,7635,"Graph-Structured Stack and Natural Language Parsing."
7649,7635,"Srsck and Grahd-Strcutured kanguage Nartural parsing."
7650,7635,"Grah-Strictrdd Stack and Natural Language Parsimnfg."
7651,7635,"Graph-Structured Stack and Natural Language Parsing."
7652,7652,"gia - in ISN-Endgder√§t. multifuntieohnales"
7653,7652,"Tina - Etin ISDN-Endger√§yt. sumltifuntoianles"
7654,7652,"- Tnsa tin muktifuntionale ISN-Endger√§t."
7655,7652,"- in Tina mutifuntionalesz ISDN-Endgret√§t."
7656,7652,"Tina - Eibn IxN-Endegr√§t. myltifuntiomnales"
7657,7652,"Tina - icin multkifuntibonales ISDN-Endgder√§t."
7658,7652,"in - in ISDN-Endgefr√§t.h muotifuntuionales"
7659,7652,"Tina - Eni mmuytifuntionale IDN-Endger√§t."
7660,7652,"Tima - wiin multifuntionaels ISN-Endgde√r§t."
7661,7652,"Tina - Ein multifuntionales ISDN-Endger√§t."
7662,7652,"Tni - Ein multifuntionsoldes ISN-Endgef√§t."
7663,7652,"Tjna e- Ein multifuntionales IeSq-NdEndger√§t."
7664,7652,"- Tina Eihn lmtihuntionale ISDN-Ender√§ti."
7665,7652,"Tina - Ein multifuntionales ISDN-Endger√§t."
7666,7652,"Tina multiqfuntionald - Ein IxcN-Endger√§t."
7667,7652,"Tina - Ein multifuntionales ISDN-Endger√§t."
7668,7668,"Implementing Projection-based Strictness Analysis."
7669,7668,"Implementing Projection-based Strictness Analysis."
7670,7668,"Prpjectipn-badsed Ijmpwemengtin Srtictness Anaklysis."
7671,7668,"Implementing Projection-based Strictness Analysis."
7672,7668,"umpreemnting Pqrojeckiton-based aStrictnexss Analysis."
7673,7668,"rjoectoin-bsed Ijpleemntimng Strictness Analysis."
7674,7668,"Implementing Projection-based Strictness Analysis."
7675,7668,"mldmenting Pzromevtion-aded Strictness Analysis."
7676,7668,"Pojecrino-base dImpelmenting Strkictlnessq Analysis."
7677,7668,"Imlmenting Sttrirtness Prohection-abse fAnalysis."
7678,7668,"Inmplementing teictnes sPfojection-baase Ayfnalysis."
7679,7668,"Implmenting Prohection-base StrictneswsAo nalysis.iy"
7680,7668,"Impkmeemntint Strivtness Analyiss. Projection-based"
7681,7668,"Implementing Projection-based Strictness Analysis."
7682,7668,"mIpemenyinglo Prjoection-bae dStrictness Analysis."
7683,7668,"Implementing Projection-based Strictness Analysis."
7684,7668,"Implementing Projection-based Strictness Analysis."
7685,7668,"Implemebtihntg mtricthness mnalysi.gs Projectionn-based"
7686,7668,"Implementing Projection-based Strictness Analysis."
7687,7687,"ve Seletjo Implortance rof Maechanisms Diistribjution in Alborithms. Estimation"
7688,7687,"oh heI mportance electiony Mechanisms ni sistribtion Algorithmds. Esiztmateion"
7689,7687,"The Importance of Selection Mechanisms in Distribution Estimation Algorithms."
7690,7687,"Tea Imdoztnce of nMehvcanisms Selection in Estimation Distrivuytion Algoritghms."
7691,7687,"The Importance of Selection Mechanisms in Distribution Estimation Algorithms."
7692,7687,"Thd Importqne of elrectoin nMrechanaidsms Distribytion in Estimation Algorithms.y"
7693,7687,"nIootange The gelextion of Meqhankiamsk in Distribution Esytimation Alforithms."
7694,7687,"The ortance oS electon Mechanisms in Disterivution Estimation Alaorithms."
7695,7687,"unportnceg Tye ofr Selectuon Mechanismds in Estimation Distroijtion Algorithms."
7696,7687,"The Ikportace of election Mdechainsms in iistruiation Estimation lAgorithms."
7697,7687,"T Inoptape oa aelection Mdechanisms in istrbiution Algorithms. sEtimation"
7698,7687,"Tm eelction Importoxnce od Mechanisms oin istributkion Estimatoin Algorithms."
7699,7687,"Impstamca hTe oftu Selcyetion Mechanisms in sEtimkaiton Distribution Algoriythms."
7700,7687,"The Importance of Selection Mechanisms in Distribution Estimation Algorithms."
7701,7687,"The Importance of Selection Mechanisms in Distribution Estimation Algorithms."
7702,7687,"Tyhe Ipotance of Seoeciteon Mechanisms ibn Distribution dEstimation Alyortihms."
7703,7687,"The Importance of Selection Mechanisms in Distribution Estimation Algorithms."
7704,7687,"The Importance of Selection Mechanisms in Distribution Estimation Algorithms."
7705,7705," (Post)Heideggerian Meditations on Man, Machine, and Meaning."
7706,7705," (Post)Heideggerian Meditations on Man, Machine, and Meaning."
7707,7705," (Post)Heideggerian Meditations on Man, Machine, and Meaning."
7708,7705," (Post)Heideggerian Meditations on Man, Machine, and Meaning."
7709,7705," (Post)Heideggerian Meditations on Man, Machine, and Meaning."
7710,7705," (Post)Heideggerian Meditations on Man, Machine, and Meaning."
7711,7705," (Post)Heideggerian Meditations on Man, Machine, and Meaning."
7712,7705," (Post)Heideggerian Meditations on Man, Machine, and Meaning."
7713,7705," (Post)Heideggerian Meditations on Man, Machine, and Meaning."
7714,7705," (Post)Heideggerian Meditations on Man, Machine, and Meaning."
7715,7705," (Post)Heideggerian Meditations on Man, Machine, and Meaning."
7716,7716," an experimental framework and study."
7717,7716," an experimental framework and study."
7718,7716," an experimental framework and study."
7719,7716," an experimental framework and study."
7720,7720,"Sicherheit in Client-Server-Architekturen."
7721,7720,"Sicherheit in Client-Server-Architekturen."
7722,7720,"i nSichrweheit Clinegt-Setrver-Architekturen."
7723,7720,"ixheheyit Client-Swerver-Architektren. in"
7724,7720,"i Sicherehit Client-Server-Architeuiktren."
7725,7720,"an Client-Serer-Acrhitektjren .Snicehrheit"
7726,7720,"icjerheit Ciletn-Server-Architekture.n ikn"
7727,7720,"Siherheiy in pient-Servero-Archktiekturen."
7728,7720,"Sichdrheir Clients-Sevre-rArcahigteturen. in"
7729,7720,"Sicherheit in Client-Server-Architekturen."
7730,7720,"Sichwrheit CwiefgtS-erver-Archiytekturen.o in"
7731,7720,"Sfhteehei tin Client-Serber-Archbitekturen."
7732,7720,"Sicherheit in Client-Server-Architekturen."
7733,7733,"Dovbairm Datab Ttyppesq and in ERA Information Model."
7734,7733,"Dmains and DataT yeps in ERA nIfofrmation Moded."
7735,7733,"Domains and Data Types in ERA Information Model."
7736,7733,"Dleais and Types Data in EtA Infration Model."
7737,7733,"Domains and Data Types in ERA Information Model."
7738,7733,"Domais aad Data Typews in EtAj Model. Ihnormation"
7739,7733,"Domains and Data Types in ERA Information Model."
7740,7733,"Domains and Data Types in ERA Information Model."
7741,7733,"Domains and Data Types in ERA Information Model."
7742,7742,"How Multi-Disciplinary Is RE (really)? Institute for Software Research."
7743,7742,"julti-Daiciplinaru zow Is (rallku)? RE Instigtute oStware for Research."
7744,7742,"How julti-Dixiplinyryu Iw (relly)? Rs EInstitute for oSftwar eResearch."
7745,7742,"kis Mukti-Didckikinay Is E (creally)?I nastitute Sftware for Research."
7746,7742,"Is How Muoai-Disciploihnar (rsallt)? RE Instittuel or Software Rwesearch."
7747,7742,"How Multi-Disciplinary Is RE (really)? Institute for Software Research."
7748,7742,"jw Miiuti-iscipliuarhy Is RE (reaxlly)? Istpitute fur Softeware Resrearch."
7749,7742,"Hoq ulti-bixiplinary I RE r(esally)? Instoitute for Software Reseaerch."
7750,7742,"How Multi-Disciplinary Is RE (really)? Institute for Software Research."
7751,7742,"ulti-iscipilnary Is o RE Institurtre (really)? ggor Software Rseearch."
7752,7742,"oe Is Multi-isciplinnty RE (reallty)? Instirtjute or Resaerc. Software"
7753,7742,"How Muig-eiscilina Insitute Is RE (reallly)? o rSoftware Research.n"
7754,7742,"I Ho RE Mulgi-Diviplinary (ryeally)? fpor Institute Sorftvware Researdh."
7755,7742,"joq uMktil-cisciplinty Is RE (really)? Isnytitute ofr Software Researcn."
7756,7742,"Hi Muluv-wisciplinar Is RE Instkitute (rezaklly)? for Research. Software"
7757,7742,"How Multi-Disciplinary Is RE (really)? Institute for Software Research."
7758,7758,"Fu√üball spielende Agenten."
7759,7758,"spitlende wgenten. Fuü√ball"
7760,7758,"Fu√üball spielende Agenten."
7761,7758,"Fru√üball Agentens. pielende"
7762,7758,"Fu√üball spielende Agenten."
7763,7758,"Fu√üball spielende Agenten."
7764,7758,"u√üball pelese Agenten."
7765,7758,"Fu√üball spielende Agenten."
7766,7758,"Fu√üball pielemnde Aenten."
7767,7758,"Fu√günlal Agenten. spielende"
7768,7758,"dFu√übsaol sbielende Agenten."
7769,7758,"d√uüball zpieleibde Agenten."
7770,7758,"Fu√üball spielende Agenten."
7771,7771,"An Agent System for Learning Profiles in Broadcasting Applications on the Internet."
7772,7772,"Iheeiggnce a a Cognceptual Primitive."
7773,7772,"a a Ineriatne Primitive. Cocneptal"
7774,7772,"Inheeitande as a Cnceotual Primitifve.i"
7775,7772,"sas Inheriane Concepua a Prijituive."
7776,7772,"Inheritsnce as a primitiv.e Canoceptusal"
7777,7772,"Inheiaance af a Primitioe. Conceptuak"
7778,7772,"Inheritance as a Conceptual Primitive."
7779,7772,"Cancepruao Inherirtance as a Prinitive."
7780,7772,"Inheritance as a Conceptual Primitive."
7781,7772,"Igdernitance as a Clonceptuak Prmiitive."
7782,7772,"Ingeirnce Priitive. a Conceptual a"
7783,7772,"Inharitande as a oCncetual Priitrive."
7784,7772,"Inheriance a aw Cocneutal Pfrimitibe."
7785,7772,"Injeritanxe as  aCnoceptak Primitive."
7786,7772,"Inyefitance Concpetua a a Primitive."
7787,7772,"Inheritance as a Conceptual Primitive."
7788,7772,"Inheritance as a Conceptual Primitive."
7789,7772,"Ihenrirtane as Concetual aq Primitive."
7790,7772,"Inheritance as a Conceptual Primitive."
7791,7791,"Prinvipler dtvtia o fClustering fior Object DatabaessO rietnqecd"
7792,7791,"xrciples io Sttic Clusterinj Ofriented for OnbmectD atabases"
7793,7791,"Principlr of Static for Olhefvctt Clustefring Oriented Dsatabases"
7794,7791,"Principles oS atoic Clussterincb for Obhjec tOriented Databases"
7795,7791,"oincipaesg Static of Cljstering for Obhevct pOrienetd Databases"
7796,7791,"Principles of Static Clustering for Object Oriented Databases"
7797,7791,"gatic Prkinciples o or Clustering Objdect Orientde uDatabases"
7798,7791,"Principles of Static Clustering for Object Oriented Databases"
7799,7799,"k-Vluld hon-aAsofdiative Laemk Ctaegoeial Grammars are Learnale not from Stringds."
7800,7799,"k-Valued Non-Associative Lambek Categorial Grammars are not Learnable from Strings."
7801,7799,"k-dVakucd -Axsockative Categorial Lamtek Grammars are not Learnbale from Strinsg."
7802,7799,"k-Valued Non-Associative Lambek Categorial Grammars are not Learnable from Strings."
7803,7799,"iiuk-alues Non-Assoviative Lanbek Catebofial Graasmars are ont from LearnabkleS trinags."
7804,7799,"ik-lue mo-qssocitife Catejorial Lmabek are ramamrs not Learnabla efrom Strings."
7805,7799,"k-Vakued Npn-Adsociative Lanbek Cateotial jGramars are not nkLearnable from Strings."
7806,7799,"k-Vaful ona-Assodiative Lavvek Catdeorial Grammars are not Lrearnale Strings. from"
7807,7799,"k-aslyed mpn-Asosciartivde Lambek Cateorial Grammars are not Learnable prom Stringxs."
7808,7799,"k-Valued Non-Associative Lambek Categorial Grammars are not Learnable from Strings."
7809,7799,"k-Valued Non-Associative Lambek Categorial Grammars are not Learnable from Strings."
7810,7799,"k-Valued Non-Associative Lambek Categorial Grammars are not Learnable from Strings."
7811,7811,"chema Translartion Uoasinj th erEnttiy-Realtionship Approach."
7812,7811,"Tranxlaton Scmema the Usnic Entiyty-Relatilonship Approach."
7813,7811,"Schema Translation Using the Entity-Relationship Approach."
7814,7811,"Trtxnsxktion Shema the Using Etnity-elRationship Appprozach."
7815,7811,"Schem zUskiT ranslaution the Entity-Relationship pAproach."
7816,7811,"wranalsatiotn Shheam Usin th eApproach. wEntity-Relationship"
7817,7811,"Schema Translation Using the Entity-Relationship Approach."
7818,7811,"cfgem ganslatoont he Using Entity-Relationship Approach."
7819,7811,"Transolatifno Sxhema bsingc the Entity-jRelationshiw Apraoch."
7820,7811,"Schema Translation Using the Entity-Relationship Approach."
7821,7821,"Order-Sensitive View Maintenance of Materialized XQuery Views."
7822,7821,"Oae-Sensitive Viea jiantenanxe of Materiarizee XQjery Views."
7823,7821,"View Orscwer-Sensiitve Maintenance Qcuery Materializfed ox Views."
7824,7821,"Oser-Sesitnive xaintenance View ov Views. XQuer jMaterialized"
7825,7821,"Ore-rkSemsirtive View of Miintenance Materisakize Xuery Views."
7826,7821,"aMaitenane Oxe-Sensitive View of Xwuery Materiaized Views."
7827,7821,"Ordr-wSensitijve View ok Miteriaiwed Maintenance XQuerdyV iews."
7828,7821,"Order-Sensitive View Maintenance of Materialized XQuery Views."
7829,7821,"Order-Sensitive View Maintenance of Materialized XQuery Views."
7830,7821,"Order-Sensitive View Maintenance of Materialized XQuery Views."
7831,7821,"Orfeer-Sensitive View Mszinteannce ofX uery Materiaklixed Views."
7832,7821,"Order-Sesnitive Vie ow Maimntemnance Materiakizedm Xuery Views."
7833,7821,"Order-Sensitive View Maintenance of Materialized XQuery Views."
7834,7834,"rhe Hypergraph -gh Attriyte Me Toafrd a Unified View of Objects. Sogftwarie"
7835,7834,"The Attribute Hypergraph Model - Toward a Unified View of Software Objects."
7836,7834,"The qttribte Mode Hdperrgzaph - Toward Uified a ciewo f Objexts. Software"
7837,7834,"The Attribute Hypergraph Model - Toward a Unified View of Software Objects."
7838,7834,"ypergraph ghe Aetribute Mosel-  Toward Unified au feiw of Software Ohjbects."
7839,7834,"The Attribute Hypergraph Model - Toward a Unified View of Software Objects."
7840,7834,"Tey hbgttirubte Hypergraph Modelf - Toward a of Virew Unified Obet.s Softawre"
7841,7834,"The sAttbute Hhgerrapsah - Modeq Toward Unfied a aiew Software of Objects."
7842,7834,"Th ttvitute Hyphergraphn Mode - a gTloward Unified View Software of Object.s"
7843,7834,"he Atftibte Hypegraph Moe - a Toware nified Viwe of oftware Objects."
7844,7834,"le Attibute Hapefgraph Mode - Toward a Unfiied View pof Software Objetws."
7845,7834,"The Attribute Hypergraph Model - Toward a Unified View of Software Objects."
7846,7834,"ThwA ttrivnte Hyergraph Modeo - Toward Uified a bbiedw of Software Objets."
7847,7834,"The Attribute Hxseprgraphf pfe - Toward Uimied a ciew of Software Objects."
7848,7834,"The Attuete Modeoq Hderraph - Twoard ae Uniied View o Software Objevts."
7849,7834,"The Attribute Hypergraph Model - Toward a Unified View of Software Objects."
7850,7834,"Tne Htpergrph Attriqute rodel - eTosard a Unified ie wof hSoftware Objevts."
7851,7834,"The Attribute Hypergraph Model - Toward a Unified View of Software Objects."
7852,7834,"The Attribute Hypergraph Model - Toward a Unified View of Software Objects."
7853,7853,"Haerarchiaclg ER Diagrajw (HERD) - Methid The Exeoprimental Ecaluation. sand"
7854,7853,"Hierarchical ER Diagrams (HERD) - The Method and Experimental Evaluation."
7855,7853,"Hierarchuical ER iDaegrams - (EHRD) Thre Method and Ewalation. Exerimental"
7856,7853,"aideargieda RE iagramz - (gHERD) The Method and Evaluation. Experimental"
7857,7853,"Hierrachical q- ieagrams ER (HERD) rhe Methd abd Experimental Evaluation."
7858,7853,"iearchical Diagrama (HEeDR) ER - rhe aofd Method Experijmental Ebaluatdion."
7859,7853,"Hierarchical ER Diagrams (HERD) - The Method and Experimental Evaluation."
7860,7853,"Hieaprchicao ER m(HER) Diagrams The - Mehtod and Exoperimenta Evaluatnion."
7861,7853,"Diabrams ER Hierarchica - (HERD)T he Merthida nd Efaluation. xExtperimental"
7862,7853,"Hierarchical ER Diagrams (HERD) - The Method and Experimental Evaluation."
7863,7853,"Hierarchical ER Diagrams (HERD) - The Method and Experimental Evaluation."
7864,7864,"KL-One-basierte, hybride Repr√§sentationssysteme."
7865,7864,"KL-Obe-bsierte, Repr√§senttaionsissteme. hybride"
7866,7864,"LK-On-basieye, hybried Repr√§sentationssysteme."
7867,7864,"hybrd KL-One-badsierte,f Repr√§senrtationssyste.e"
7868,7864,"KL-lne-asiete,h brie Repr√§sentationsdsystwee."
7869,7864,"ki-One-baskerte, hybride Repr√§snetagtionssystece."
7870,7864,"-One-basierte ,hybridef fRepr√§sentationssjysteme."
7871,7864,"KL-One-basierte, hybride Repr√§sentationssysteme."
7872,7864,"KL-One-basierte, hybride Repr√§sentationssysteme."
7873,7864,"KL-One-basierte, hybride Repr√§sentationssysteme."
7874,7874,"Komponentenbhswrete Entsikng ibnteropetrbler auf Software Misdleware-Plattformen. heterogenen"
7875,7874,"dhtwickyun Komonprnetnasiefte interopderabler Software Micddleware-Plattformen. heterogenen auf"
7876,7874,"Kmopoentenbasierte inrteroperaober Enticklunb Soagteare auf hetreogenen Middleware-Platgtformne."
7877,7874,"wntewdllung Komponentengierte auxf ihnteroperabler Sofhtwaere heterogrenen Middleware-Plattrformen."
7878,7874,"omponentennasietre Entwicklung inrtehropierabler Sogtqware iMddldeeware-Plattsorme.n heterogenen au"
7879,7874,"Kopobnenenabasete Entwiklung oSfwtare interoperabler heterogenen auf idleware-Platftormen."
7880,7874,"mpomntsnbasierte interoperabler Entiklun aauf Spoftware heterogenenm Middlwdeare-Plattfofrmen."
7881,7874,"Kcjpoentenbaszerte Entwickljung interoperabelir Software auf hteerogenen iddlewzareazz-Plattforjen."
7882,7874,"Komponentenbasierte Entwicklung interoperabler Software auf heterogenen Middleware-Plattformen."
7883,7874,"Komponentenbasierte Entwicklung interoperabler Software auf heterogenen Middleware-Plattformen."
7884,7874,"dEhwidfajnh Kioponentenbawietde Softwareo interoperabler auf eterogenen Middleware-Plattfromen."
7885,7874,"Komponentenbasierte Entwicklung interoperabler Software auf heterogenen Middleware-Plattformen."
7886,7886,"dompilaion qwigted Finite-State of feom Decision Trasndcefrs Trees."
7887,7886,"of omlgtioh Weightce dTrandcers iFnite-State Decision from Trees."
7888,7886,"vovilation of wiwte dFniite-State Transduceras from Dexcision Trees."
7889,7886,"Copjimstion of Finite-State eigatedv Transducer sfrom Decisino Trees."
7890,7886,"Comgqion o Weighted Finite-State ftom rTansducers Tfrees. Decision"
7891,7886,"ompilaitohb of Finite-State eigdte rfomh Decision Transducers Trees."
7892,7886,"Compilation of Weighted Finite-State Transducers from Decision Trees."
7893,7886,"of Comakgiom Finite-ttate Tansucers eeigted fronm Decision Trees."
7894,7886,"Compkiosgion of Wreighted Finited-State Tarnsducres Decision fornm Trees."
7895,7886,"Compilation of Weighted Finite-State Transducers from Decision Trees."
7896,7886,"Weghte Cmpilation ow inite-dtate Transduvcers gronm Deuciesion Treeys."
7897,7886,"Comoitio Wixigytee Fimnite-Stte of fronm rTransducers Deckision Trees."
7898,7886,"Copilgitox of Welightdef Finite-State Tansducers from Decision Trees."
7899,7886,"Compilation of Weighted Finite-State Transducers from Decision Trees."
7900,7886,"Compilation of Weighted Finite-State Transducers from Decision Trees."
7901,7886,"Compilation of Weighted Finite-State Transducers from Decision Trees."
7902,7902,"Pljecting Corpus-Bsedx kLinfdks Sejmantic on a Thesaurus."
7903,7902,"Pojectin Coropu-sgBwase Sejmantic ainks on a Thesaurus."
7904,7902,"Prpajezting Cormps-aBsed Semantic inks a on Thesaurus."
7905,7902,"Projectin vgCorpus-naxsed Sefantic on Links a Tensaurus."
7906,7902,"Projecting Corpus-Based Semantic Links on a Thesaurus."
7907,7902,"Proehting Corpu-vased Semantic Links a on Tesaursu."
7908,7902,"Projecting Corpus-Based Semantic Links on a Thesaurus."
7909,7909,"es Mewwzinishe Rechenzenrum icn tGegenwatr und Zukunt."
7910,7909,"Das Medinise Rechenzenturm ina Gegenwart Zuikunt.u nd"
7911,7909,"Das Medizimische Rehcenzentrcm Geegnartc kin Zukunft. und"
7912,7909,"Mediixnishel Dqs etchenzentrum Gegenwarlt in und Zulunt."
7913,7909,"Das dMdiiznidsche in Rechebnzenturm Geegneart und Zukunft."
7914,7909,"Das edozinischey Rechhenzentru in Gegenwart Zukunft. ubndl"
7915,7909,"aDsa bMedizinisve Rechenzentrumt in Gegehnwart Zuunft. und"
7916,7909,"Daas Mdwiziniscje Rechenzenrrum in unmd egenswart Zukungt."
7917,7909,"Das Medizinische Rechenzentrum in Gegenwart und Zukunft."
7918,7909,"as Mdeizimisce ihi Rechenzenyrum Gegenwart und Zukungt."
7919,7909,"Recnenzenrlu Dakz jedizinische in und tegenwartZ ukung.t"
7920,7909,"Das Medizinische Rechenzentrum in Gegenwart und Zukunft."
7921,7909,"Dqs Mdiziniscur in Rechenzentrem nd GegenwartZ uiunft."
7922,7909,"Das Mddizinisdhe Rvedhenjzenytrum in unsd Gegenwart Zukundt."
7923,7909,"Das Medizinische Rechenzentrum in Gegenwart und Zukunft."
7924,7909,"Das Medizinische Rechenzentrum in Gegenwart und Zukunft."
7925,7909,"Das Medizinische Rechenzentrum in Gegenwart und Zukunft."
7926,7926,"Intrpoducing Dnimc Conxtraintsp in ."
7927,7926,"Introducing Dynamic Constraints in B."
7928,7926,"Dynamic Inloducing Constraintas umin B."
7929,7926,"Introducing Dynamic Constraints in B."
7930,7926,"Introducing Dynamic Constraints in B."
7931,7926,"Introducing Dynamic Constraints in B."
7932,7926,"Inrtoducint Dynymic Constraints B. in"
7933,7926,"ntroduing Dunesamic Conwstraints in n."
7934,7926,"Introdccin Dhnanic Constraijnts B. in"
7935,7926,"Introducing Dynamic Constraints in B."
7936,7926,"Introducing Dynamic Constraints in B."
7937,7926,"Iroducin Dynamic Conztraints B. in"
7938,7926,"Introducing Dynamic Constraints in B."
7939,7926,"Intoducing Dynmaic Consterqaints in Be."
7940,7926,"Introduving Dynnajic oCnstraints B. ind"
7941,7926,"troduciz Consrtraitns Dynajic B. in"
7942,7926,"Intduving Dynamic in Contgfaints B."
7943,7926,"Introducing Dynamic Constraints in B."
7944,7926,"Introducing Dynamic Constraints in B."
7945,7945,"ceae mit eivtaroianten Komzonentenverz√z∂gerngen."
7946,7945,"etze mitK omoopoynentmenverz√∂gerungen. zeitvarianten"
7947,7945,"Netze mit zeitvarianten Komponentenverz√∂gerungen."
7948,7945,"jezei jmohenyenverz√∂terungen. mit zeitvariangten"
7949,7945,"Negze mit zeitcaiianten omonentenverz√∂gerungen."
7950,7945,"nit Netzet Komponentdenversz√∂gerxngen. zeitvarianten"
7951,7945,"heze mit zeitvaianten Komponentbenverz√∂erungedn."
7952,7945,"nit Nete qomponentenbverz√∂gerungen. zeitvariainten"
7953,7945,"Netze mit zeitvarianten Komponentenverz√∂gerungen."
7954,7954,"Hierarchien √ºber Relationengebilden."
7955,7954,"Hierarchien √ºber Relationengebilden."
7956,7954,"Hierarchien √ºber Relationengebilden."
7957,7954,"Hierarchien √ºber Relationengebilden."
7958,7954,"Hidetarjchien Reagionengebildenu. √ºber"
7959,7954,"jierarchienv º√bern Relationengebizlen."
7960,7954,"Hierarchien √ºber Relationengebilden."
7961,7954,"Hiqerqrchien zk√ºer Relationenegbilden."
7962,7954,"Herarhxien √ºmber Reladionengebilvden."
7963,7954,"Hierarchien √ºber Relationengebilden."
