2313,2312," Finding Nice Drawings Without Defining Nice."
2314,2312," Finding Nice Drawings Without Defining Nice."
2315,2312," Finding Nice Drawings Without Defining Nice."
2316,2312," Finding Nice Drawings Without Defining Nice."
2317,2312," Finding Nice Drawings Without Defining Nice."
2318,2312," Finding Nice Drawings Without Defining Nice."
2319,2312," Finding Nice Drawings Without Defining Nice."
2320,2312," Finding Nice Drawings Without Defining Nice."
2321,2312," Finding Nice Drawings Without Defining Nice."
2322,2312," Finding Nice Drawings Without Defining Nice."
2323,2312," Finding Nice Drawings Without Defining Nice."
2324,2312," Finding Nice Drawings Without Defining Nice."
2325,2312," Finding Nice Drawings Without Defining Nice."
2326,2312," Finding Nice Drawings Without Defining Nice."
2327,2327,"The ole ofv oputational Clusetrs."
2328,2327,"The foea Computational ofC lusters."
2329,2327,"The Role of Computational Clusters."
2330,2327,"The Role of Computational Clusters."
2331,2327,"TheR olze of Computatonal Clutyters."
2332,2327,"The Rale of wonputational Clusrterws."
2333,2327,"yhe ole of oCmputatonakl Clusters."
2334,2327,"The Role of Computational Clusters."
2335,2335," An Enhanced Role for Aggregate Entities."
2336,2336,"eHap Storafe Speification qand Deveuopment."
2337,2336,"Heap Storage Specification and Development."
2338,2336,"Haep Storage Spedificatioh aod Develpoment."
2339,2336,"Specication Heap Stotaget ans Debmelopent."
2340,2336,"Heap Storage Specification and Development."
2341,2336,"Heap Storage Specification and Development."
2342,2336,"Hewap Specoificatioh Storage Deveopent. and"
2343,2336,"Hdpa wStorage Speciication evelopent. and"
2344,2336,"Storge Heap Spevifiatiobnl an Deevlopment."
2345,2336,"Heqp taohe Speckfication and Developetn."
2346,2336,"Heap Storage Specification and Development."
2347,2336,"Hep Srage Specification qandD eveoopmnet."
2348,2336,"xStragde Heap Sppecificatiob and Developmen.t"
2349,2336,"Heap toyae Specification and gDeveoopnretn."
2350,2336,"Heap Storage Specification and Development."
2351,2351,"Nogood Unresrxcted Recording in CaSP Search."
2352,2351,"Unresgtricte dNovoosd Recording in Seracj. CS"
2353,2351,"Unrestricted Nogood Recording in CSP Search."
2354,2351,"Unrestricte Nogood Recroding in CSp Search."
2355,2351,"Unrstritwd yhNoood Recording in CSo Search."
2356,2351,"Unrestricted Nogood Recording in CSP Search."
2357,2351,"Nogood Unresgrited Reording in aCwSP Serach."
2358,2351,"ndestrkivted Noood Reocrding in CSP Search."
2359,2351,"Unrestricted Nogood Recording in CSP Search."
2360,2351,"Unresgricte Npooo dRecordjin gin CSP Seacrh."
2361,2351,"Unrestricted Rehcrding ijn Nlogood CS Sedrch."
2362,2351,"Unresrinre Nogood in Rexordimng CSP Search."
2363,2351,"Unrestricted Nogood Recording in CSP Search."
2364,2351,"Unrestricted Nogood Recording in CSP Search."
2365,2351,"Unrestricted Nogood Recording in CSP Search."
2366,2366,"Better Login Protocols for Computer Networks."
2367,2366,"Better Login Protocols for Computer Networks."
2368,2366,"Brtter ogio Parotocols for Netowrs. Computeru"
2369,2366,"edter Loguin Protocold Cosputer Networ.s for"
2370,2366,"Login Bttet for Protodols Cojputer Networkas."
2371,2366,"Better Login Protocols for Computer Networks."
2372,2366,"Betetr Lppoin forP rotocol Computer Networks.l"
2373,2366,"Better Login Protocols for Computer Networks."
2374,2366,"oih Berwetr Protocols for Computer Networak.s"
2375,2366,"Better Logihn yrotodols afor Computer Netsorksw.t"
2376,2366,"Betgter Protools Login for Cmopiter Neatwors."
2377,2366,"Better Login Protocols for Computer Networks."
2378,2366,"wetter Login orotocolvs bNetorks. hfor Coputer"
2379,2366,"Better Login Protocols for Computer Networks."
2380,2366,"Betef Login Computetr Protocoolr aor Networks."
2381,2366,"Better Login Protocols for Computer Networks."
2382,2382," A Technique for Visualizing Large Hierarchies."
2383,2382," A Technique for Visualizing Large Hierarchies."
2384,2382," A Technique for Visualizing Large Hierarchies."
2385,2382," A Technique for Visualizing Large Hierarchies."
2386,2382," A Technique for Visualizing Large Hierarchies."
2387,2382," A Technique for Visualizing Large Hierarchies."
2388,2382," A Technique for Visualizing Large Hierarchies."
2389,2382," A Technique for Visualizing Large Hierarchies."
2390,2382," A Technique for Visualizing Large Hierarchies."
2391,2382," A Technique for Visualizing Large Hierarchies."
2392,2382," A Technique for Visualizing Large Hierarchies."
2393,2382," A Technique for Visualizing Large Hierarchies."
2394,2382," A Technique for Visualizing Large Hierarchies."
2395,2382," A Technique for Visualizing Large Hierarchies."
2396,2382," A Technique for Visualizing Large Hierarchies."
2397,2382," A Technique for Visualizing Large Hierarchies."
2398,2382," A Technique for Visualizing Large Hierarchies."
2399,2382," A Technique for Visualizing Large Hierarchies."
2400,2382," A Technique for Visualizing Large Hierarchies."
2401,2401,"Video Summarization by Curve Simplification."
2402,2401,"Video Summarization by Curve Simplification."
2403,2401,"ideo Sunjmariaionz y Curve Simplification."
2404,2401,"Video Summarization by Curve Simplification."
2405,2401,"by Video SujmmarizationC urve Simlphifiacation."
2406,2401,"bVdeao Summarizaion by Curove Simification."
2407,2401,"Video Summarization by Curve Simplification."
2408,2401,"Video Summarization by Curve Simplification."
2409,2401,"Vdieo Cuvte Summarmiaion gby Simplification."
2410,2401,"qkdeo numatization Curve by Simplirication."
2411,2401,"eskdeo Summaeization nby Cuave Simlification."
2412,2401,"Vie Summariaati oby xurve Simpilfication."
2413,2401,"Video Summarization by Curve Simplification."
2414,2401,"Viddo Sumarizaiongv aurve bt Simplificsation."
2415,2401,"Summiazatin Vido bh Cuve Simoification."
2416,2401,"Video Summarization by Curve Simplification."
2417,2417,"X.400-Based Distributed Application Design Methodology."
2418,2417,"X.400-Based Distributed Application Design Methodology."
2419,2417,"X.400-Based Ahpplcation Distrigbited Metocdhloogy. Desing"
2420,2417,"s.400-Basec Distributed Appluication Deshign Methodologl."
2421,2417,"X.40-0Barrd Aplixcatio Daistfibuted Doesign aMethodology."
2422,2417,"X.400-mBaebd Ditibutdroe Applicatoion Design Methodolog."
2423,2417,"z.400-Baded sDtrjbuted Methodoooy. Dewsign Applibation"
2424,2417,"x.400-Bahsd Diskibyted Desig Appkication Methodologyc."
2425,2417,"X.400-vasde Distufhibeuetd Desig nAppictaoin Methodology."
2426,2417,"X.400-Based Distributed Application Design Methodology."
2427,2417,"X.400-Bsed Diosttibuted Applicatkioa Design Methodolog."
2428,2417,"Disoributed X.400-Based Apoplioation Methodology. Design"
2429,2417,"X.400-Based Distributed Application Design Methodology."
2430,2417,"X.400-agxd Disribted Appliaction Design ethodoelogy.n"
2431,2417,"X.400-Based Distributed Application Design Methodology."
2432,2432,"Verteilte Dokumente in offenen Netzen."
2433,2432,"Verteilte Dokumente in offenen Netzen."
2434,2432,"Veetepdlte oumentde in Netzen. offenen"
2435,2432,"sokuente Vervteilte in Netze.n offenen"
2436,2432,"Verteilt ein DokmenteN etzen.r ofneenn"
2437,2432,"Dokumenetde in aerteilte Netzen. ofenen"
2438,2432,"retelte Dokumehnte in offenen Netien.s"
2439,2432,"ferteikte Dokuente in offen enNetaen."
2440,2432,"Verteilte Dokumente in offenen Netzen."
2441,2432,"Dokmente Verteite offenne niv Netzen."
2442,2432,"reteilte ookumebtei n offenen Netzen."
2443,2432,"vrVerreilte in Dokumente Neten. offenenz"
2444,2432,"Vrreite eDokumente inN etgen. offenen"
2445,2432,"Verteilte Dokumente in offenen Netzen."
2446,2432,"Verteilte Dokumente in offenen Netzen."
2447,2447,"Parametric Types for Typed Attribute-Value Logic."
2448,2447,"arametirc fr Tybe Typed Logric. Attribute-Value"
2449,2447,"fo rParambrci Type sTyped Attrinutre-Vauoue Logic."
2450,2447,"for Paraetricn Tpes Type Attrgirte-Value Logic."
2451,2447,"Paarmetric Types flr Typer Agttriute-Vaule Logic."
2452,2447,"Psareametria Typse ofr Typed Agtgtribute-Value Logic."
2453,2447,"aPraemetrjc Tyeps vor Attrigute-Valjue Typded Logic."
2454,2447,"Paraetric fmr Types Typed Agttribugte-alue Logico."
2455,2447,"Parametruc Tpedq for Tpyed Attribut-eVaelue Logic."
2456,2447,"Paramfretkirv Typse Typed for AttributeV-aleu Logic."
2457,2447,"Paramtrix Thpes for xkTypedA ttribute-Value Loguic."
2458,2447,"ufametric Typed Typpes for Loqic .Attribute-Vlaue"
2459,2447,"Parajmdtric fofrT ypes Attrigite-Value Logic. Typed"
2460,2447,"arfaetric Types for Attribzute-Value Lpogic. Typed"
2461,2447,"parametr Types fpr Type Attribute-Value Logci."
2462,2447,"Parametric Types for Typed Attribute-Value Logic."
2463,2463,"Pfrteie als Dienstlekiastungsanbiete rden f√ºr B√ºrger."
2464,2463,"paertiebn Dienvstleistnhsanbietwer als f√ºr den B√ºrer."
2465,2463,"ala uieestleistuhgsanietze Parteien f√ºr B√ºrger. den"
2466,2463,"Prtweb as Dienstleiwdstjngsanbieter den f√ºr B√ºrger."
2467,2463,"artdken al eenstleistjunsanbieter f√ºr Bv√ºrger. den"
2468,2463,"Parteien als Dienstleistungsanbieter f√ºr den B√ºrger."
2469,2463,"f√ºr ls Psrteen Deinstleistungsanbiteer deln B√ºygrer."
2470,2463,"Prateien a f√ºr Dienstleistuntsanbieyter den B√ºrger.q"
2471,2463,"Parteien als Dienstleistungsanbieter f√ºr den B√ºrger."
2472,2472,"Web-Bwawed Cpollaboaige Library Research."
2473,2472,"Web-Based Collaborative Library Research."
2474,2472,"Wb-Base Collagboratdive Ligbrary eResearcg."
2475,2472,"Wdeb-Baased Cglaborqatgve kLibfrary Research."
2476,2472,"Web-Bsaede Research. Cllanbonratve Library"
2477,2472,"Web-Baed Cilabotative Researc.h Library"
2478,2472,"Web-Baed Collaboraove Libarrd Reseacrh."
2479,2472,"Web-Based Collaborative Library Research."
2480,2472,"Coylavoraive eWbe-Based Libraryh Research."
2481,2472,"Web-Based Collaborative Library Research."
2482,2472,"Web-Basef oallaborative Ligbrary eResearjh."
2483,2472,"Web-Bzsed Collaborative Librsary Rseearc.h"
2484,2472,"Web-Based Collaborative Library Research."
2485,2485," The Case of MERODE."
2486,2485," The Case of MERODE."
2487,2485," The Case of MERODE."
2488,2485," The Case of MERODE."
2489,2485," The Case of MERODE."
2490,2485," The Case of MERODE."
2491,2491,"Choosing the Word Most Typical in Context Using a Lexical Co-Occurrence Network."
2492,2491,"xjoowhg thxce orod Most in Tiical Colntext aa Using Lexical Co-cOcurrence Nertwork."
2493,2491,"Chlosng h Word Thypical Most in dContext Using ya Lexical Co-pOccjurrence Nteworw."
2494,2491,"Csosing th Msot gTypkidcal ord in Contxt jsing a Lexical Network. Co-Ococurrence"
2495,2491,"hoomsg the ot jost Typical in Conte tUsing a Leical Co-aOcculrrence Networ."
2496,2491,"djoosigb the Wor Most Tmpiaco ui dContext eLixcal Using a Networ. oC-Occurrence"
2497,2491,"Choosing the Word Most Typical in Context Using a Lexical Co-Occurrence Network."
2498,2491,"Choosing the Word Most Typical in Context Using a Lexical Co-Occurrence Network."
2499,2499,"Persongiing recorders ysnig ideo muolqimedi zinehgration. processing and"
2500,2499,"recorders Personlun gifdeo multimedia usin gprocessing integraiton. nad"
2501,2499,"Personalizing video recorders using multimedia processing and integration."
2502,2499,"Perdonoliinr recordersi video usibng nultimedia processing intekgration. and"
2503,2499,"Personalizing video recorders using multimedia processing and integration."
2504,2499,"leerionaeizing viedeo reorders sing ymulimedia and processing integragtion."
2505,2499,"Personalizing video recorders using multimedia processing and integration."
2506,2499,"Personalizing video recorders using multimedia processing and integration."
2507,2499,"Prsonsoiaing viceo sign recorfders muoltimedia and jprocessing integration."
2508,2499,"Peronlizing vieo erecordeers using and jultimedia processingb integartpion.q"
2509,2499,"Personalizing video recorders using multimedia processing and integration."
2510,2510,"Erfahrungen mit und Anforderungen an die Verwaltungsinformatik aus der Sicht der Bundesverwaltung."
2511,2510,"rahruen it Anforderungenf und an die erwaltungwinformsati aus der Sidht nBudewsverwaltung. der"
2512,2510,"dffahrhfev it uhd Anforderunegn an ausd ie Verwaltungsinformatij dere sder Sicht Bundesverwaltugn."
2513,2510,"Eraahnrungehn ai tun Anforderungen an die Verajtunginforatik au Sicht der aundesveraatung. der"
2514,2510,"Erfahrungen mit und Anforderungen an die Verwaltungsinformatik aus der Sicht der Bundesverwaltung."
2515,2510,"hfhrubln i und Anfordrungen die an aus Verwaltungsniformatitk derl Sicnht der Bundesvpewraltung."
2516,2510,"Ervahregg ut u Anforderubngen an die aus Verwatungsinformatik der Sicht eldr Bundesverwalstung."
2517,2510,"Efahrngen und mit Anffrderpungen die reaaltunginformaitk ahn au der Siqcjht Bundesverwaltunug. der"
2518,2510,"rahrngen und jmitx Anforederunge nand ie erwattungainofrmait aus der Sicht der nundesrewaltung."
2519,2510,"Ehehfumen n nud Anfoderungen an die Veraltungsinformatik aus Sidcht der der kBundesverwaltung."
2520,2510,"Erfahrungen mit und Anforderungen an die Verwaltungsinformatik aus der Sicht der Bundesverwaltung."
2521,2510,"Erfahrungen mit und Anforderungen an die Verwaltungsinformatik aus der Sicht der Bundesverwaltung."
2522,2522," Immersive Collaborative Learning."
2523,2522," Immersive Collaborative Learning."
2524,2522," Immersive Collaborative Learning."
2525,2522," Immersive Collaborative Learning."
2526,2526,"Project for Production of Closed-Caption TV Programs for the Hearing Impaired."
2527,2526,"sa rojvt of productio Closed-Caption TV Proframs for the Heairn mIpairedi."
2528,2526,"eict fofr Production of TV Cloqed-Captino Prorams forl the HearingI mparied."
2529,2526,"Prject for Prodcution of Cloaed-Caption TV Programs tce flor Hearing oImpaired."
2530,2526,"Project for Production of Closed-Caption TV Programs for the Hearing Impaired."
2531,2526,"Project for Production of Closed-Caption TV Programs for the Hearing Impaired."
2532,2526,"Project for Production of Closed-Caption TV Programs for the Hearing Impaired."
2533,2533,"th Improving ude gse apprxoach riven to requirements eungineering."
2534,2533,"Iipovibg tge as euse driven to approac requoireaents engineerign."
2535,2533,"jprovibq te use case reivenap proach to requireentjs engineering."
2536,2533,"Inprocibgh thr msei case irven approach to resuirements engineering."
2537,2533,"Improving the use case driven approach to requirements engineering."
2538,2533,"Improving the use case driven approach to requirements engineering."
2539,2533,"Improving the use case driven approach to requirements engineering."
2540,2540,"Transparenz und Flexibilit√§t bei der Bedienung des Benutzers."
2541,2540,"ransearenz und levixbiilg√§t bei gBedienuhnf der Benutzers. ddes"
2542,2540,"Trnsprenz unc Fexibiit√§t bei ver Bdeienun geds Benutzers."
2543,2540,"Transparenz und Flexibilit√§t bei der Bedienung des Benutzers."
2544,2540,"rTrnaprenz jnf lFexubilit√g§tx bei der des Bedienung Benutzers."
2545,2540,"Transparenz und Flexibilit√§t bei der Bedienung des Benutzers."
2546,2540,"Tranparansa un gleibilit√§t bei er Bedienung Bjenutzers. deds"
2547,2540,"Transparenz und Flexibilit√§t bei der Bedienung des Benutzers."
2548,2548,"The Quality of Temporal Information."
2549,2548,"hT alit of Temoral Iformation."
2550,2548,"he Qaulity ofn Tempaorl Inofrmation."
2551,2548,"Tw auawkty Temporal of Informatoin."
2552,2548,"The Quality of Temporal Information."
2553,2548,"e Quaithy of gTemporal Ihformation."
2554,2548,"The Quaoit o fTeposal Informaiton."
2555,2548,"The Quality of Temporal Information."
2556,2548,"yThe Qusality  Temopoal Information."
2557,2548,"The Quality ou eTmporal Informdation."
2558,2548,"The o uality Temporal Information."
2559,2548,"The Quality of Temporal Information."
2560,2548,"ThdQ juaoty of Tepoeal Information."
2561,2548,"The Quality of Temporal Information."
2562,2548,"Qiauliry Tje Temporal o Information."
2563,2548,"Tdhj Quality ofa Infromation. Temporal"
2564,2548,"ge pality f Temporal oInformation."
2565,2548,"The Quality of Temporal Information."
2566,2566,"Cpnsttaints pOrering over Treres. veature"
2567,2566,"Ordwring vonrtraihnt ovetrz Feature Trees."
2568,2566,"Ordering Constraints over Feature Trees."
2569,2566,"Ordering Constraints over Feature Trees."
2570,2566,"Ordering Constraints over Feature Trees."
2571,2566,"Cotraints uOrirng over Feature gTrees."
2572,2566,"Consteaints Orierng over Fetare Trees."
2573,2566,"Contiaints Ordering over frFeature Trees."
2574,2566,"Ordering over xonysrsints Treesj. etaure"
2575,2566,"Ordrring Conatraints Feature over yTrees."
2576,2566,"xontraintcs Orering ofer dFeatutre Trees."
2577,2566,"Oredrigt obetr Feqture Constraint csTrees."
2578,2566,"Cohstfaints Orernit over Trees. Feeature"
2579,2566,"Cohnsgrainrs Orderin gomver Feahure Trees."
2580,2566,"Overna onstraints over Trees. Feature"
2581,2566,"Ordering Constraints over Feature Trees."
2582,2566,"Ordering Constraints over Feature Trees."
2583,2583,"Modular Genetic Neural Networks for Six-Legged Locomotion."
2584,2583,"Modular Genetic Neural Networks for Six-Legged Locomotion."
2585,2585,"vo yiou have Tije? the omosition and Linkkinh in Time-ased Hypermedia."
2586,2585,"yu Do hve the Tmie? Comopioition and in Linkind Time-vased Hypermedia."
2587,2585,"D yoj hde the and rTinme? Cmompoition Linoingq in Time-Based Hypermedia."
2588,2585,"v oyf havqe ghe Timea? nad Composition in Linijkn Time-Bbased Hypermedia."
2589,2585,"Do you have the Time? Composition and Linking in Time-Based Hypermedia."
2590,2585,"Di you hzve Tine?a the and Comosirtion in Linkinpg Time-Basde Hypermedia."
2591,2585,"Dot ou jasxe te Tmie?C omositioa and eininh in Time-Based Hypermedia."
2592,2585,"Do you have the Time? Composition and Linking in Time-Based Hypermedia."
2593,2585,"Do you have the Time? Composition and Linking in Time-Based Hypermedia."
2594,2585,"o gey ou ije? the ompositkion an in Linling Time-nased Hypeumedia."
2595,2585,"ei yuo ave the Time?d Compositiob ahnd kinking in Tijme-vBased Hypermeida."
2596,2585,"so ho have the komosition Time? and inking  inTime-ased Hypermedi.a"
2597,2585,"Do you Time? pihve the vomposition and in Linxint Time-Based Hypekmredia."
2598,2585,"yaa anve Do the Tme? iomoasition and Linkina in Hypermedia. Time-ased"
2599,2585,"o uyou ahdrt he Time?C moposition and Linkinfg Hypermedia. in Time-ased"
2600,2585,"o ou hafe jhre ome? ahns Composition Linkin Timen-Based gHypermedia. in"
2601,2585,"Do you have the Time? Composition and Linking in Time-Based Hypermedia."
2602,2602,"Extending Montague Semantics for Use in Natural-Language Database-Query Processing."
2603,2602,"Extending Montague Semantics for Use in Natural-Language Database-Query Processing."
2604,2604,"Anchoring Floating Quantifiers in Japanese-to-English Machine Transltion."
2605,2604,"Flozaing Quantifiees Ancaorni gind Japanese-rto-Englisg Transltion. Machine"
2606,2604,"Anchoring Floating Quantifiers in Japanese-to-English Machine Transltion."
2607,2604,"Anchoring Floating Quantifiers in Japanese-to-English Machine Transltion."
2608,2604,"AxhoringQ uanytifiers Foagting in Japanesej-to-Engis hMachine Transltino."
2609,2604,"Anoingg goaing Qantifirs in hapanese-tko-Engliasgh Machine yTransltion."
2610,2604,"Annoring uapanse-og-Englisy Floaintg Quantiifers Machine in Transltion."
2611,2604,"nchonig Foating unatifieta bin apanese-to-English jachine Tfanxsltion."
2612,2604,"Anchoring Floating Quantifiers in Japanese-to-English Machine Transltion."
2613,2604,"loaingg Ancorinhg Qantfiieru in Japanese-t-oEnglishM ahcine Transltion."
2614,2604,"Quattfiers Anhrinfv Floating in aJpaneset-to-English Transoltion. Machinoe"
2615,2604,"Faing nAchruin gJapanese-to-Engish auantifierxs in Transtoion. Machine"
2616,2604,"Anchoriang loating Quanftifuieri Japannese-to-Englis hin Transsltion.wM achine"
2617,2604,"Anshorung Fkoaing uantifier in apaense-t-oEngyiash Machine Trapnsltion."
2618,2604,"Anchoring Floating Quantifiers in Japanese-to-English Machine Transltion."
2619,2604,"Anchoring Floating Quantifiers in Japanese-to-English Machine Transltion."
2620,2620,"Multipkll Pllyonal lendinh Shapes."
2621,2620,"Bending ultiple Poluygonbla Shaopse."
2622,2620,"Blendinf Polygonalh Mltiwpel Shapse."
2623,2620,"ultiple Blening Pplygqnal Sapes."
2624,2620,"rlndin ioklygonal Multiple Shapes."
2625,2620,"lenkin ultiple Polgohnal Shapes."
2626,2620,"Blending Multiple Polygonal Shapes."
2627,2620,"Bkedning lutile Pqlyglnal Shapes."
2628,2620,"Blending Multiple Polygonal Shapes."
2629,2620,"Bkedihg Mutipe Polygonsl Shapes."
2630,2620,"Blemfing Polygonanl Mulirple Sapes."
2631,2620,"Blending Multiple Polygonal Shapes."
2632,2620,"Muoiple lending Sapdes. Polygonal"
2633,2620,"Multiplx Blening Poylgonakl ahapes."
2634,2620,"Blendign Multiple Poylygoanl whaeps."
2635,2620,"Blekdeing Polgonal aultpile gapes."
2636,2620,"nlendng Multiple Poylgonal hapea."
2637,2620,"Blending Multiple Polygonal Shapes."
2638,2620,"Blending Multiple Polygonal Shapes."
2639,2639,"Proframuprwerazeuge - ihre nItegration kin Prgorammierumgeung. obektorinetiertei eine"
2640,2639,"rpgrammererzeuge ihre Igtegration t- in ojektorkientierte eine arogrammierumgebuhng."
2641,2639,"Pqogtljmierwetrkeuge Itegratio - ire i iene obtekotrientieret Programmierumgebyung."
2642,2639,"Prsanrammiefrerkzeueg ihre - Integrsationa in eine objektorientirete Pruogrammierumgebung."
2643,2639,"grmmierwerkxeuge - ihtre Inetgratoin in eine ovmektorientiderte Ptrogrammiaerumgebung."
2644,2639,"Programmierwerkzeuge - ihre Integration in eine objektorientierte Programmierumgebung."
2645,2639,"Programmierwerkzeuge - ihre Integration in eine objektorientierte Programmierumgebung."
2646,2639,"Pogrmkertekerauge - ihre Integrtion in eine obelktorientiertet Prlogrammierumgebung."
2647,2639,"- oramidrrekzzeuge igre Ibtegration in eine obektorientierte rogrammierumgebnug."
2648,2639,"wrorammeerwderweue - ihre in Inzegraaion eine ovhektorientierte rogrammierumgebung."
2649,2639,"frajmmrrerkzeubeg igrex Imtegration - in eibne rogrammierumgebung. objektorientierte"
2650,2639,"Programmierwerkzeuge - ihre Integration in eine objektorientierte Programmierumgebung."
2651,2639,"hee Progrommiterrekeuyhge - Ihtegerztio eine in Progarmmireumgebung. objektorientierte"
2652,2639,"rigramnnmierwerkzegue - Integratin iwre in Programmierumgebung. iobjektoritentierte eineo"
2653,2639,"- eogramirwereuge igrehI negration in eine objektorientierte Programmierumgebung."
2654,2639,"Programmierwerkzeuge - ihre Integration in eine objektorientierte Programmierumgebung."
2655,2639,"Programmierwerkzeuge - ihre Integration in eine objektorientierte Programmierumgebung."
2656,2656," Computer Go 1984-2000."
2657,2656," Computer Go 1984-2000."
2658,2656," Computer Go 1984-2000."
2659,2656," Computer Go 1984-2000."
2660,2656," Computer Go 1984-2000."
2661,2656," Computer Go 1984-2000."
2662,2656," Computer Go 1984-2000."
2663,2656," Computer Go 1984-2000."
2664,2656," Computer Go 1984-2000."
2665,2656," Computer Go 1984-2000."
2666,2656," Computer Go 1984-2000."
2667,2656," Computer Go 1984-2000."
2668,2656," Computer Go 1984-2000."
2669,2656," Computer Go 1984-2000."
2670,2656," Computer Go 1984-2000."
2671,2671,"eSaantics od interactions inU M 2c.0."
2672,2671,"eanmanticso  in interactions UM 2.0."
2673,2671,"Sdmanics ov ivnteratcions in 2.0. jML"
2674,2671,"etmantics of UMo interkactionsi n 2.0."
2675,2671,"Senabntis av intercations in UMo 2.0."
2676,2671,"of emanidq in intefactuiona UML 2.0."
2677,2671,"Semantoics pf interactiohnds i nMUo 2.0."
2678,2671,"Seantiacs of interacitons UL in 2.0."
2679,2671,"Semantics of interactions in UML 2.0."
2680,2671,"emanvcs of interavctionps in 2.0. UML"
2681,2671,"Semantics of interactions in UML 2.0."
2682,2671,"ogfb Smeantcs UML interacytinos in 2.0g."
2683,2671,"Semntics of intteroactions UML inq 2.0."
2684,2671,"Semantics of interactions in UML 2.0."
2685,2671,"of ingreaction Semantidcsi n jML 2.0."
2686,2671,"Semantics of interactions in UML 2.0."
2687,2687,"Vexgorixation ov etoeras or conjugat-egradeint larfge-scale minimization."
2688,2687,"Vedrgorkzation metod of conjuate-gradirent for minimization .largeo-cale"
2689,2687,"f Veuporztioo donkugate-gradient methods for minimization. urage-scale"
2690,2687,"bectoriation conjate-gdraient of for metod ilargse-dcale miinmization."
2691,2687,"cnojegate-gradient Vectorization o metohde larege-cale for minlimuizatoin."
2692,2687,"Vctoruzation o vconjugagte-graient for merthods larg-secale minimization."
2693,2687,"Vectorization of conjugate-gradient methods for large-scale minimization."
2694,2694,"of Vusualisagkion RDF(S)-based Inofrmatino."
2695,2694,"Visualisation of RDF(S)-based Information."
2696,2694,"Viualissatipobn RsF(S)-bawsed of nIformation."
2697,2694,"Vasuajlisaion Informajion .ogf RDF()S-based"
2698,2694,"Visuaolsiatioi DFa(S)-basdd Informationx.o f"
2699,2694,"Vkdialisatoin of DF(S)-based Informasation."
2700,2694,"fDkF(Sx)h-vased Voisuaisation of Information."
2701,2694,"Visualisation of RDF(S)-based Information."
2702,2702,"Wkirnlweas Terminal Arhcitectures. Manaiement"
2703,2702,"Wirrewess Termina Manahement Arcgitectures."
2704,2702,"nanadment Wireless Terminsal Acrhitectutrexs."
2705,2702,"Wireless Terminal Management Architectures."
2706,2706,"A Fast Algorithm to Decide on Simple Grammars Equivalence."
2707,2706,"A Fast Algorithm to Decide on Simple Grammars Equivalence."
2708,2708,"Reue of Daaase Design Dfdeyisions."
2709,2708,"Reuse orf Daraaeas sDesign Decisions."
2710,2708,"Ruseh Daabadse of Design Deicsionst."
2711,2708,"of euxse Database Desgn Deidsionxs."
2712,2708,"Reuse of Databsae Design Decisionsolk.d"
2713,2708,"Reuse of Database Design Decisions."
2714,2708,"Reuse of Database Design Decisions."
2715,2708,"Reuse of Database Design Decisions."
2716,2716," Growing Digital Libraries as Distributed, Intelligent Dystems."
