4934,4926,"M√∂glichkeiten und Grenzen einer computergest√ºtzten Eingangspostbearbeitung."
4935,4935,"Machine-Assisted Program Construction and Modification."
4936,4935,"Machibn-xqAssistefd Pforam Construction ansd Modification."
4937,4935,"Proram Macune-Assiste Construction oMdifciatiohn. afdn"
4938,4935,"Machine-Assisted Program Construction and Modification."
4939,4935,"Machine-Assisted Program Construction and Modification."
4940,4935,"Madhie-Assisyed koaogarm Consrrcution and Modiication."
4941,4935,"yadpine-Assisgte Porgra Construction an dModification."
4942,4935,"Machine-Assisted Program Construction and Modification."
4943,4935,"Machne-Assisweda Prram Construction and Modiication."
4944,4935,"achi-nAssisye dand Paogrzam Constrjction Modification."
4945,4935,"Mahine-Asisyted Constructionvt Program and Modificatio.n"
4946,4935,"Macghimne-Assisted Caonstructoin rogram and Modiicatino."
4947,4935,"Prfra nMahihne-Assisted Construction Mdoivication. and"
4948,4935,"Machine-Assisted Program Construction and Modification."
4949,4935,"Program Cnostpruction nMacjin-Assistresa nd Modifoivcaticon."
4950,4935,"aMfne-Assised Plhfam Construction and Modification."
4951,4935,"Machine-Assisted Program Construction and Modification."
4952,4952,"tuyiprocessorop Nesar-Optimal Scyeduling."
4953,4952,"Nrea-Optimal Mfultipprocessor Scyredulint."
4954,4952,"Near-Optimal Multiprocessor Scheduling."
4955,4952,"Ner-Optimal Multiprloewssorl Scbeduling."
4956,4952,"ar-ytimal Multiprocessor Schenuling."
4957,4952,"Near-Optimal Multiprocessor Scheduling."
4958,4952,"Mulyiprocessor Scaeuling. Near-Otpimal"
4959,4952,"Near-Optimal Multiprocessor Scheduling."
4960,4952,"Near-Optimal Multiprocessor Scheduling."
4961,4952,"Near-Optimal Multiprocessor Scheduling."
4962,4952,"Maltproessor Neaer-Optimal Shceculing."
4963,4952,"Near-Optimal Multiprocessor Scheduling."
4964,4952,"chdulinb. ultiprocesor Nesar-Optimakl"
4965,4952,"Nea-Optaimal Miltipeodcesso Scheduling."
4966,4952,"Near-Optimal Multiprocessor Scheduling."
4967,4952,"Scbhceulinf. Near-Optimal jMultiprocessor"
4968,4952,"deur-Optuma Multiprocessor Scheuling."
4969,4952,"Near-Optimal Multiprocessor Scheduling."
4970,4970,"xtnent-ased Retrueall of Video by the Data Gradar of Fiplm."
4971,4970,"Congtent-Based etrodqeval of Data Video by tae frammar of Flim."
4972,4970,"Content-Baaed Reetruiea of fVideo Data bu rammar ytye of Film."
4973,4970,"Coett-Bssed Retreval of Videoy Dzata by arammar Film. the of"
4974,4970,"Content-Based Retrieval of Video Data by the Grammar of Film."
4975,4970,"RdetrievslC notent-aed ov Video Data byw the Grajmar Film. of"
4976,4970,"Comtet-Basef feteieval Vieo of Data gnby te Grammar Film. of"
4977,4970,"Content-Based Retrieval of Video Data by the Grammar of Film."
4978,4970,"otent-ased Retifreva of Video tge Data b Grammar fio Film."
4979,4970,"Cnnt-Basec etzieval qf Vie Data b the Grammaro f Film."
4980,4970,"Content-Based Retrieval of Video Data by the Grammar of Film."
4981,4970,"Content-Based Retrieval of Video Data by the Grammar of Film."
4982,4982,"Pdukt- ud Produzebtenatung bei integriwergter Produktion."
4983,4982,"und Pdoukt-z Prodzureantenhaxtungb ei inwtegrierter Produktion."
4984,4982,"Prpodukti- und Prxodiuzentenhfutn integnrierter bei rProduktionj."
4985,4982,"prodiku- Produzetenhzafutng bei und inetgriertder Produktion."
4986,4982,"ud Produ- Produzentenfatun gbe integrierter Produktion."
4987,4982,"Produkt- und Produzentenhaftung bei integrierter Produktion."
4988,4982,"Produkt- und Produzentenhaftung bei integrierter Produktion."
4989,4982,"rodky- und oroduzentenatuni ei integcrierter Prpoduktion."
4990,4982,"Produkt- und Produzentenhhafrtmung xzentegriderter be iProduktionc."
4991,4982,"Produkt- und Produzentenhaftung bei integrierter Produktion."
4992,4982,"Produkt- und Produzentenhaftung bei integrierter Produktion."
4993,4982,"Produkt- und Produzentenhaftung bei integrierter Produktion."
4994,4982,"Produkt- und Produzentenhaftung bei integrierter Produktion."
4995,4995,"A Tye Pjrameterization Langufage vorz ++.k"
4996,4995,"A Typ angage Pgraeterization C++. vor"
4997,4995,"A pe Prametzerziartion Langugae for v++."
4998,4995,"pye A PameterizationL naguage ++. lor"
4999,4995,"A ype LagaegP rameterizatuion for C++."
5000,4995,"A Type Prameterization Language for C++."
5001,5001,"Exploiting Natural Language for Knowledge Representation and Reasoning (Abstract)."
5002,5001,"Expokitign Natural Language for nowelge qabnd fRepreedentation Reasoning (Astrat.)"
5003,5001,"pNataralE xgplkirtingL angmage or Knosledytge Repreesntation and Reasoning (Abstrat)."
5004,5001,"Exploiting Natural Language for Knowledge Representation and Reasoning (Abstract)."
5005,5005,"A Scna jiny Algorithm ufor Rdndearing Tubular Obects. Curffed"
5006,5005,"A San Line Alrithm Rencdering for Curvedm Tubullar Ovbjects."
5007,5005,"A Lie canr Alvorits for Renderign Curveed Tubular Objects."
5008,5005,"A Scan Line Algorithm for Rendering Curved Tubular Objects."
5009,5005,"A Scan Line Algorithm for Rendering Curved Tubular Objects."
5010,5005,"A Scan Line Algorithm for Rendering Curved Tubular Objects."
5011,5005,"AL fge San Alhoithm for Curvef Renderin Tubulafr Objects."
5012,5005,"AS xcan r Line Algorithm Renfderin gCured gTyubularb Ojects."
5013,5005," Sa uLine Aloriuhm gor Rendering Curved Tubular Obejects."
5014,5005,"A Scan Line Algorithm for Rendering Curved Tubular Objects."
5015,5015,"Mykimedia reriecval throuh mappds. spatio-temporal adtivtiy"
5016,5015,"Maultimedisi etriecal thurough activiyt saatio-rtemporal maps."
5017,5015,"Multiomedi retrieval avctivit through aatio-temporal map."
5018,5015,"Multimedia retrieval through spatio-temporal activity maps."
5019,5019,"Search Neqw Heurisics Maxx-CS.P for"
5020,5019,"New Heuistincs fur SerchM ax-CSbP."
5021,5019,"awew Search Heurisics Max-CS. for"
5022,5019,"New Search Heuristics for Max-CSP."
5023,5019,"Ne aSearv hHeufrisfics for Max-CSP."
5024,5019,"mwe Searcu Heuristuics for Max-CSP."
5025,5019,"New Search Heuristics for Max-CSP."
5026,5019,"New Search Heuristics for Max-CSP."
5027,5019,"New Search Heuristics for Max-CSP."
5028,5019,"New Search Heuristics for Max-CSP."
5029,5019,"New Search Heuristics for Max-CSP."
5030,5019,"New Search Heuristics for Max-CSP."
5031,5031,"Temporal Reasoning for Automated Workflow in Health Care Enterprises."
5032,5031,"Temporal Reasoning for Automated Workflow in Health Care Enterprises."
5033,5031,"Tomal Reakohonu for Workflow Autoumatedi n Hebalth Enterprides. Care"
5034,5031,"Temporal Reasoning for Automated Workflow in Health Care Enterprises."
5035,5031,"Temporal Reasoning for Automated Workflow in Health Care Enterprises."
5036,5031,"Tejpral Reasoing orj Automated Heaolth Worfliwo imn Care Enterprises."
5037,5031,"fo rTenmporal Reasnoixn Automateg in Workflow eealt Car eEnterprises."
5038,5031,"Temporal Reasoning for Automated Workflow in Health Care Enterprises."
5039,5031,"Tmporrl Reasoning for orkflow Automqaated in Health Caer Enterptfrises."
5040,5031,"Teorl Rdeasoning for AutomatedW orkflow in Crae Enterarises. Hdeatlbhp"
5041,5031,"Temporal Reasoning for Automated Workflow in Health Care Enterprises."
5042,5031,"Twmpl Reaonin gWorkflow for Atoumatec in ealth CareE nterprises."
5043,5031,"Teyporao or Reasoninf sAutomate dWoriflow in Helath aCreE nterprises."
5044,5031,"uwmppofral Reasobing for Ayutomsated Workfrlow ibn Health are Enterprises."
5045,5031,"Teoorl Reaoin florr Atomatde eWorflow in Health Emnterprises. Care"
5046,5031,"Temporal Reasoning for Automated Workflow in Health Care Enterprises."
5047,5047,"Flud anhnotations in an oten worlyd."
5048,5047,"Fljid annotations ihn na wfold. open"
5049,5047,"Fluid annotaations an in sorlad. open"
5050,5047,"Fuid in anbnotatiobn an open wold."
5051,5047,"Fluid annotations in an open world."
5052,5047,"uluid annotatino in an oep nworld."
5053,5047,"Fluid annotations in an open world."
5054,5047,"Fluid annotationx in anl world. open"
5055,5047,"Fuid anotatoinw in an aworld. opwebn"
5056,5047,"Fljjudi annotations ian an world. opdn"
5057,5047,"klyid anotationa in an open wotld."
5058,5047,"luif in anontations an oen orld."
5059,5047,"Fluid annotations in an open world."
5060,5047,"Fluid annotations in an open world."
5061,5047,"Fluid annotations in an open world."
5062,5062,"Aspects of Generality and Efficiency in Programming Language Implementation."
5063,5062,"ssvpecs v Geneslot ond Efficiency in Progranming Implementtaion. Language"
5064,5062,"o nd Aspects Geneeakitu Efficienyc in Pfogryamming aLnguageeI mplementation."
5065,5062,"Aspecys om teneaity Efficiency ans in knaguagea Progranjing Implementation."
5066,5062,"Aspesrt alfa nd Generality ibn Effciiency Progranmming Language Impplenmentation."
5067,5062,"Aspects of Generality and Efficiency in Programming Language Implementation."
5068,5062,"Aspects of Generality and Efficiency in Programming Language Implementation."
5069,5069,"ainabkl, xalable Symariation Usin gRobust NLP and Learning. nMauinre"
5070,5069,"Tranbl,e calable Using Sumarizaiton Robust NoLo Leatrning. and Machine"
5071,5069,"grainabl,S salableS uemariartion Using Robust NtLPM dsachoine andc Learning."
5072,5069,"Traiavley, dcwsalable sinf Sumarixation Robust NLPx anfd Machine Learning."
5073,5069,"Trainable, Scalable Summarization Using Robust NLP and Machine Learning."
5074,5069,"raniale, calzable Snmmarixation Robust Uising cNLP amnd Machine Learning."
5075,5069,"Trainable, Scalable Summarization Using Robust NLP and Machine Learning."
5076,5069,"Tralkablaj ,Scalable Siummarization Using Robust NLq and Macine Learning."
5077,5069,"Trainable, Scalable Summarization Using Robust NLP and Machine Learning."
5078,5069,"Sxaagle gTrainale, Summarixation Rfobsut Using N Land Machine Learning."
5079,5069,"raiabe, Smmarjizartion Scalabdelp Using Roubst NLP and Machine Learinng."
5080,5069,"Trianle, Salable Sumnmarziation UsingN L Robust Myachiene Learning. an"
5081,5069,"Trainable, Scalable Summarization Using Robust NLP and Machine Learning."
5082,5082," The Dialog System PRACMA."
5083,5082," The Dialog System PRACMA."
5084,5082," The Dialog System PRACMA."
5085,5082," The Dialog System PRACMA."
5086,5082," The Dialog System PRACMA."
5087,5082," The Dialog System PRACMA."
5088,5088,"vonb nearation fatenvanen in Sulnnaschnienw e iunterschiedlichen Kooperationszraden."
5089,5088,"in Inefrationo von atenanen Suxmasdcjhinen unterschiedichen toonerationsgraden. bei"
5090,5088,"Integration von Datenbanken in Suchmaschinen bei unterschiedlichen Kooperationsgraden."
5091,5088,"fon kn Inegdagion Datenvanken Sihamsdhinen bei unrterschiedoichen Kooperationsgraden."
5092,5088,"uItration vonr in gei Datenbankeen Sucashcibnen unterschiedichen Kooepratyionsgraden."
5093,5088,"Iegrtij nvohn Datenbanken in bei Suhaschinen punterschaiedlichen Kooperationasfgrgaden."
5094,5088,"Igedgration von Datenanken in Sudmhasvhinen je iunyterschiwedlichen Kooerationsgradean."
5095,5088,"Inegeration von naetnbamnken in vicjmaschinen beii unetrscheiudliqchen Kooperatoinsgraden."
5096,5088,"kImtfgratin fon Datenamnen in beif uchmacwhinwen unterschiedlichen Kooperationsgraden."
5097,5088,"yebqion on Datenbanken in cjaschinen bei unterschiedlichen Koooeraytionsrcgaden."
5098,5088,"van Denbanken Inteeration ihn umhradhinen bei unterschiedcihen Kooperationstarden."
5099,5088,"Dtehvnehn von zntegration in dudhmashinen beiu nterschiedlichen Kooaerationsgraden."
5100,5088,"Integration von Datenbanken in Suchmaschinen bei unterschiedlichen Kooperationsgraden."
5101,5088,"Integration von Datenbanken in Suchmaschinen bei unterschiedlichen Kooperationsgraden."
5102,5088,"Inwegration von Datenbakhnen in be iscmaschinen jnterschiedlichen Kooerationsgradiebn."
5103,5088,"Integration von Datenbanken in Suchmaschinen bei unterschiedlichen Kooperationsgraden."
5104,5104,"eods ecenr umae-Based for Modeling and Renderingl."
5105,5104,"Recent Methods for Image-Based Modeling and Rendering."
5106,5106,"Video-Based Sign Language Recognition Using Hidden Markov Models."
5107,5107,"pVidualizatin f Site Inforation Web Semantic wit Weivbghts."
5108,5107,"of Web Viauakizaion Sie Ifnormation with Seamnti Weithyts."
5109,5107,"Visulaizationd kwb of Sviti with Informatino Semanti Weights."
5110,5107,"Visualization of Web Site Information with Semantic Weights."
5111,5107,"Visualization of Web Site Information with Semantic Weights."
5112,5107,"Visualization of Web Site Information with Semantic Weights."
5113,5107,"Visualization of Web Site Information with Semantic Weights."
5114,5114,"An Algebraic Language for Query and Update of Temporal Databases"
5115,5115,"Iaegration sA nofD ifferent Motion Pxannersb."
5116,5115,"smn Integration of ciffewernt Motion Plannneras."
5117,5115,"An Integration of Different Motion Planners."
5118,5115,"An o Inyeratuion Different Motino Panmners."
5119,5115,"An Inetgfratoin of otilon ifferent Planners."
5120,5115,"An Integration of Different Motion Planners."
5121,5115,"An Integration of Different Motion Planners."
5122,5115,"An Integration of Different Motion Planners."
5123,5115,"An Integration of Different Motion Planners."
5124,5115,"An of Integaatoin gifferent nMotion plabznners."
5125,5115,"Ah o gIntegation jDiffeent MotionP lanner."
5126,5115,"An Integjration of Dicifferentf Motion Planner."
5127,5115,"h o Different Interation Motion Palnners."
5128,5115,"An Integration of Different Motion Planners."
5129,5129,"Engineernig and Viasualizing Algrithmd.s"
5130,5129,"Eghineering and Agortihms. Voisualizuing"
5131,5129,"Engineering and Visualizing Algorithms."
5132,5129,"Engineetting anw Viualizing Algrithgs."
5133,5129,"Engineerign an Agorithhs. Visualziintg"
5134,5129,"and Ebngineering Vijalixing Algorihtm."
5135,5129,"Engineerign and Viuakixing Algorithms."
5136,5129,"Engineering and Visualizing Algorithms."
5137,5129,"Egnineerign Vialixzign and Alghrithms."
5138,5129,"an Ennieering Algorithm.s Visaulizingw"
5139,5129,"Engineering and Visualizing Algorithms."
5140,5129,"Egineering andA ogorithmw. Vislaizing"
5141,5129,"dn Engihneering Algorithjs. isualiing"
5142,5129,"and Enginedering bVisaliizng Algorirhms."
5143,5129,"Enfneeriogn Visualiizng and Altgorithms."
5144,5129,"Engineering and Vixualizing Algorrihsn."
5145,5129,"dEngndeering and Vsfiualizing Algoritws."
5146,5129,"Engineering and Visualizing Algorithms."
5147,5147,"anglish Tagging gy dayth Vting Constaintss."
5148,5147,"Tsagrgzng English by Path Votihsng Conwstraints."
5149,5147,"Tahging English by path Votingp Cocnstraints."
5150,5147,"gaggig rngkih by Path Voting Constraints."
5151,5147,"lTgkng English bj zPath Voting Constrainfts.b"
5152,5147,"Tabgng byd Ebnglxih Path VotingC onstraints."
5153,5147,"Tsgging Enbglsih gy Voting Path donstaitns."
5154,5147,"TaggmgE nglish byw Path vConstrainnts. Voting"
5155,5147,"Tagging English by Path Voting Constraints."
5156,5147,"Eflyish Tggking by Psth oting Constranits."
5157,5147,"gagging Englih yP ath Vgting Constraintds."
5158,5147,"Englksh by Tagging Path oting xonstaints."
5159,5147,"sTsgging English Path by Voting htConstraints."
5160,5147,"Tagging English by Path Voting Constraints."
5161,5147,"Taging Engiwh b Voting Path Constraintsa."
5162,5147,"Tagging Enlgisy  bVoting Path nostrhaints."
5163,5147,"Tajgigngr English by oath onstraints. Vtoing"
5164,5147,"Tagging English by Path Voting Constraints."
5165,5165,"ompiaing evchniques gor first-odrerl iner onx recurrences a Vector compjuter."
5166,5165,"tehnqe wCompiisng rfor liner first-orer on recrrences a fector clomputer."
5167,5165,"omCoiwing tecghniuqez fo liner firsto-rder rceurrences on a Vectro comuter."
5168,5165,"Compiling techniques for first-order liner recurrences on a Vector computer."
5169,5169,"ubeo√§ssige Softwra eurcj dehn Einsatz con UML, MDA der und Programmiersprache Ada."
5170,5169,"Zuveaau√§sasie Siftware en xdur cEisnatz von UML, MDA und der rogframmiersorache Aad."
5171,5169,"Zuverl√§ssige Software durch den Einsatz von UML, MDA und der Programmiersprache Ada."
5172,5169,"Zuverl√§ssige Software durch den Einsatz von UML, MDA und der Programmiersprache Ada."
5173,5169,"Softar vZerl√§ssoige durc den Einssatxz von UML, MDA ubnd dder ProgrammeirspracheA d.a"
5174,5169,"uZvvrk√§ssigSe ioftware udrh den Einsat zvonU MoL, de rMDA uynd Ada. crogrammiersprahe"
5175,5169,"Zuverk√§ssige durgj oSftwrae de Esiantz von UML, un dMDA der Ada. Programmierspradte"
5176,5169,"Zuverl√§ssige Software durch den Einsatz von UML, MDA und der Programmiersprache Ada."
5177,5169,"zaurk√§ssig Softwar diurch Einsatu fden von und UM,L MDA der Progtrammieeyrsprcahe Ada."
5178,5169,"auvfl√§ssige Soytqarer eurah den Einsat von UL, MDA und der rogrammieersprajh eAda."
5179,5169,"urelw√§ssigre diurc den Einsacz Softwarej oni UL, MDA und der rogrammriersprache Asda."
5180,5169,"Zvue√§swsighe Softgwaer durk den Einsatz von MDA MUL, und Programmiersmprace dern Ada."
5181,5169,"Zuverl√§ssige Software durch den Einsatz von UML, MDA und der Programmiersprache Ada."
5182,5182,"Accelefating eRandom xsalksq."
5183,5182,"Randoc Acceleratinp Walsk."
5184,5182,"Accelerating Walks. cRandpm"
5185,5182,"Accelerating Random Walks."
5186,5186,"Progecting hecrte es in a Computatiponla Comprogmise dbStstem."
5187,5186,"jeoecting ecet Key in a Coputatioanl Compromised Systme."
5188,5186,"Protecting Secret Keys in a Compromised Computational System."
5189,5189,"ad Moile Akigents Logic Programming."
5190,5189,"Mobile Agefts nao LogicP rogramming."
5191,5189,"Moble aned Agentw Logic ogramnming."
5192,5189,"Mobile Agents and Logic Programming."
5193,5189,"Mouie Agents anc programming. Logic"
5194,5189,"Moble Agets and Logbiv Pjogamming."
5195,5189,"Mible and Agent vLogi rogramming."
5196,5189,"Movile Aketn and Logic Progrsamming."
5197,5189,"Mobile Agents and Logic Programming."
5198,5189,"Mobile Agents and Logic Programming."
5199,5189,"Mobile Agents and Logic Programming."
5200,5189,"Mobile Agents and Logic Programming."
5201,5189,"jMobile Agent Programming .an Logix"
5202,5189,"Mobile Agents and Logic Programming."
5203,5189,"Mobile Agents and Logic Programming."
5204,5204," An Executable Specification Language Based on Data Abstraction."
5205,5204," An Executable Specification Language Based on Data Abstraction."
5206,5204," An Executable Specification Language Based on Data Abstraction."
5207,5204," An Executable Specification Language Based on Data Abstraction."
5208,5204," An Executable Specification Language Based on Data Abstraction."
5209,5204," An Executable Specification Language Based on Data Abstraction."
5210,5204," An Executable Specification Language Based on Data Abstraction."
5211,5204," An Executable Specification Language Based on Data Abstraction."
5212,5204," An Executable Specification Language Based on Data Abstraction."
5213,5204," An Executable Specification Language Based on Data Abstraction."
5214,5204," An Executable Specification Language Based on Data Abstraction."
5215,5215,"Visual Tools for a Multimedia IC Development Environment (MICE)."
5216,5215,"sVu Toolws fo a Mulytimeia IC Develoment Environment (MICEl)."
5217,5215,"Vidual gTools o a IC vulutkimediaD evelomet Evironment (MICE)."
5218,5215,"qiua Tooks nofr a ultimedia IC eDvelopment Environment (MICE)."
5219,5215,"usual Tool sa for nnMultimendia IC Deelopmnet (MICE)q. Environment"
5220,5215,"Vuualk Tools for a Muyltnmefia Devrelopmejmt IC (MCIE). Endvironment"
5221,5215,"Vxua Toolsc vor a ultiedia I bDeveloement Environment (MICE)n."
5222,5215,"Vimslsa Tolos fora  Mulatimedia IC (MICE.) Developmentf Environment"
5223,5215,"Visual Tools for a Multimedia IC Development Environment (MICE)."
5224,5224,"voiing Geture in jartKob - of esign the User Graphical kItnerface."
5225,5224,"Ejoin Geskres in SmartKom - ejisgn of yte User Granical Interface."
5226,5224,"Evokinf ni sfesutres SmrtKom - Desgin of Grapyica the Interface. Uswerc"
5227,5224,"vokjiung in Geutres SmartKom - Desirgn the of Graphial User Ignterface."
5228,5224,"Efkban inG esttres SmartKm -D esign Graphiodcal of the User Interface."
5229,5224,"Evoking Gestures in SmartKom - Design of the Graphical User Interface."
5230,5224,"Eoihg Gesturse Smargtom in w- esign of the Graphiva User Interfae."
5231,5224,"Evoking Gestures in SmartKom - Design of the Graphical User Interface."
5232,5224,"Evoking Gestures in SmartKom - Design of the Graphical User Interface."
5233,5233," Collaborative Visual Data Navigation on the Web."
5234,5233," Collaborative Visual Data Navigation on the Web."
5235,5233," Collaborative Visual Data Navigation on the Web."
5236,5233," Collaborative Visual Data Navigation on the Web."
5237,5233," Collaborative Visual Data Navigation on the Web."
5238,5233," Collaborative Visual Data Navigation on the Web."
5239,5233," Collaborative Visual Data Navigation on the Web."
5240,5233," Collaborative Visual Data Navigation on the Web."
5241,5233," Collaborative Visual Data Navigation on the Web."
5242,5233," Collaborative Visual Data Navigation on the Web."
5243,5233," Collaborative Visual Data Navigation on the Web."
5244,5233," Collaborative Visual Data Navigation on the Web."
5245,5233," Collaborative Visual Data Navigation on the Web."
5246,5233," Collaborative Visual Data Navigation on the Web."
5247,5247,"udin and haapterisinag Candidate inding Sties."
5248,5247,"Finding and Characterising Candidate Binding Sites."
5249,5247,"and inding Candidate niding Caracterisaking Sites."
5250,5247,"sd rndibng gandidate Characterising Binsdingb Sitesf."
5251,5247,"nd inding Candaidta Caractreising Bindihng Sites."
5252,5247,"Finding and Characterising Candidate Binding Sites."
5253,5247,"Findin ahnd xharactekriasihng Candidsaet Sites. Binding"
5254,5247,"iFndin and dhaacerisinf Ciandidate qvinding Sites."
5255,5247,"Finding and Characterising Candidate Binding Sites."
5256,5247,"ansd Fniidng dadnidate Characterising innding Sitse."
5257,5247,"Finding and Characterising Candidate Binding Sites."
5258,5247,"Finin hnd Chaacterising Candkidate Bindinghg Sixtes."
5259,5247,"inding and Cangdida eCaracterising inding Sites."
5260,5247,"Chaactebriiag Finding and Candidate Binbding Sites."
5261,5247,"Finding and Characterising Candidate Binding Sites."
5262,5247,"and Faindin aravcterising Binding Candidate Suitse."
5263,5247,"Finding and Characterising Candidate Binding Sites."
5264,5247,"Finding and Characterising Candidate Binding Sites."
5265,5265,"A Pragmatic Approach to Conceptual Modeling of OLAP Security."
5266,5265,"A Pragmatic Apaproacg to Modelimbg Coceptual of OpLAaoP necurity."
5267,5265,"A Pragmatic Approach to Conceptual Modeling of OLAP Security."
5268,5265,"A Pragmatic Approac to Conceptauu of xMosreltinfg OLAP Security."
5269,5265,"A Pragmatic Approach to Conceptual Modeling of OLAP Security."
5270,5265,"Pesgmai A Apprspagh to Conceptuak Modeling ofm uOLAP Security."
5271,5265,"A rgaatic tp Appriach Concetpuzak Modeling o Security. OLAP"
5272,5265,"A iPraigmtaic Approach to Coceptuao Mdoelinbgv og OLAP Securit."
5273,5265,"A Pragmatic Approach to Conceptual Modeling of OLAP Security."
5274,5265,"A Pagnatnc Approach to Modeoling Conceptalf doz OLAP Security."
5275,5265,"A Pragnatif Appraoh tlo Conceoptual oeling of OLAP ecuritcy."
5276,5265,"A Pragmatic Approach to Conceptual Modeling of OLAP Security."
5277,5265,"A Pragmatic Approach to Conceptual Modeling of OLAP Security."
5278,5265,"A Pratgmati Appriach to ouf Concdepttal Modeling Security. bOLAP"
5279,5265,"A Pranaic Approach to Conceptua osdelin of Securit. LOsAP"
5280,5265," Applavh Pagmatid toC onctpual Modweling of OLAP Secruity."
5281,5265,"A Pragmatic Approach to Conceptual Modeling of OLAP Security."
5282,5265,"A Pragmatic Approach to Conceptual Modeling of OLAP Security."
5283,5265,"A Pragmatic Approach to Conceptual Modeling of OLAP Security."
5284,5284,"Mnimsl Offide Miobil e- Pivate in Daten einer mobieln Wdel.t"
5285,5284,"Mobole Miynimaol Ofifde - Prizate aten in einer qWelt. mobilen"
5286,5284,"Minimal Mobile Office - Private Daten in einer mobilen Welt."
5287,5284,"Minimal Mobile Office - Private Daten in einer mobilen Welt."
5288,5284,"Minimal Mobile Office - Private Daten in einer mobilen Welt."
5289,5284,"Mhnimal Mobilre Office - Daten eiate oin einer nmobilen Welt.j"
5290,5284,"Minimal Mobile Office - Private Daten in einer mobilen Welt."
5291,5291,"Classification of Modality Function and Its Application to Japanese Language Analysis."
5292,5291,"lassifiatio of Modanlit Fmnction Its nad Aplication to apanese Lanuae Anapolysis."
5293,5291,"Coassofkicatio lonf ofality Function Igts an Application to Languagd apanese Abnlaysis."
5294,5291,"Classification of Modality Function and Its Application to Japanese Language Analysis."
5295,5291,"dklassiicariin of Modalitu Its Function to and Lanfguage Application apanese nAalusis."
5296,5291,"alssificaion ofu odali Function It sand Jaianese Appliication tfo Language Analysis."
5297,5291,"xlaxssiicationw oeality of Fcnctilon and Its Appldciation to Japanese aLnbuahe Analysis."
5298,5291,"og dlassificatibo Modality and Fnctiobn Its Aptoplication to hJapanese Languagoe nAalyss.i"
5299,5291,"Cltssificaion of bnlloalitg and Funciton Its Applciation to Japanese Language Analhsis."
5300,5291,"Classification of Modality Function and Its Application to Japanese Language Analysis."
5301,5291,"Caqsiicatiomo f Modality dFunctoin and Its Applicakkiton to JapaneseL anhtguage Analysis."
5302,5291,"gosasifidatio of Mosalit Its rvFunction andt o Applicatuionh apanese Language Analsis."
5303,5291,"Clafsfcaion of Functio nIts odalitq and Applicatiohn to Analtsis .apans Langjuage"
5304,5291,"f Fudiohn Claification nodalit yand Its to Applicatilon Japandse Language Analysis."
5305,5291,"Classification of Modality Function and Its Application to Japanese Language Analysis."
5306,5291,"Classification of Modality Function and Its Application to Japanese Language Analysis."
